{
  "protocol_version": "starliner.protocol.v1",
  "record_id": "quilr1-fixture-record-002",
  "record_type": "source_observation",
  "schema_version": "starliner.source_observation.v1",
  "source_profile": "starliner.source.quilr1_clickhouse_application.v1",
  "source_profile_version": "0.1.0-proposed",
  "claimed_tenant_id": "tenant_fixture_001",
  "source_definition_id": "quilr1-clickhouse-application",
  "source_installation_id": "quilr1-fixture-installation",
  "runtime_instance_id": "quilr1-fixture-runtime",
  "claimed_producer_identity": "synthetic://quilr1-adapter-fixture",
  "adapter_id": "quilr1-platform-adapter",
  "adapter_version": "0.1.0-proposed",
  "claimed_certification_id": "not-certified-fixture",
  "operation": "upsert",
  "source_native_id": "tenant_fixture_001:app_fixture_001",
  "source_revision": "out-of-order-fixture",
  "supersedes_record_id": null,
  "occurred_at": "2026-07-28T00:00:00.003Z",
  "observed_at": "2026-07-28T00:00:01.003Z",
  "enqueued_at": "2026-07-28T00:00:01.010Z",
  "clock": {
    "quality": "unknown",
    "offset_ms": null,
    "uncertainty_ms": null,
    "boot_epoch_id": null,
    "monotonic_ns": null
  },
  "sequence": {
    "stream_id": "quilr1-fixture-application-stream",
    "epoch": "fixture-epoch-001",
    "number": "0",
    "previous_record_hash": null
  },
  "correlation": {
    "traceparent": null,
    "tracestate": null,
    "observation_id": "quilr1-fixture-observation-002",
    "session_id": null,
    "request_id": null,
    "run_id": "quilr1-fixture-extraction-run-001",
    "step_id": null,
    "action_id": null,
    "decision_id": null,
    "command_id": null,
    "reconciliation_run_id": "quilr1-fixture-reconciliation-001",
    "trail_id": null
  },
  "privacy": {
    "collection_policy_id": "quilr1-fixture-policy",
    "collection_policy_version": "0.1-proposed",
    "highest_classification": "enterprise_identifier",
    "content_reference_count": 0,
    "capture_summary": {
      "enterprise_identifier": 4,
      "structural": 2
    }
  },
  "idempotency_key": "quilr1:application:tenant_fixture_001:app_fixture_001:out-of-order",
  "body_hash": "sha256:4c1119abdf97468092d56769d66f4ec82a18edd604f3759f452d24394fc9cea2",
  "record_hash": "sha256:53495153f17b25f213b36c3f021b4aabb27f8a30a88997f0bec17c44ecedcf5e",
  "signature": null,
  "body": {
    "source_object_type": "legacy_application_row",
    "source_table_profile": "clickhouse.application_projection.unresolved_version",
    "schema_fingerprint": "unresolved-live-schema",
    "row": {
      "tenant": "tenant_fixture_001",
      "subscriber": "subscriber_fixture_001",
      "app_id": "app_fixture_001",
      "app_name": "Fixture Generative AI App",
      "domain": "fixture-ai.example.invalid",
      "app_category": "Generative AI"
    }
  }
}
